{
  "$schema": "http://json-schema.org/draft-07/schema#",
  "title": "Point of Interest",
  "description": "An authored place inside a field map -- a shrine, a fossil cliff, a river house. The generator never invents these; it lays terrain and the adapter places them on it, which is what keeps Garudasaur's Ledge a specific place rather than a random cave.\n\nDeep locations do not get their own entity type. A point of interest that can be entered carries `sub_locations`, so Garudasaur's Ledge is one record listing its cliff, moss cavern, nest and bone field rather than five records and a container.",
  "type": "object",
  "required": [
    "id",
    "type",
    "name",
    "field_map",
    "kind"
  ],
  "properties": {
    "id": {
      "type": "string",
      "pattern": "^poi_[a-z0-9_]+$"
    },
    "type": {
      "const": "point_of_interest"
    },
    "name": {
      "type": "string"
    },
    "field_map": {
      "type": "string",
      "description": "field_map id this sits within."
    },
    "kind": {
      "type": "string",
      "enum": [
        "settlement",
        "wilderness",
        "eco_site",
        "archaeological_site",
        "anomaly",
        "travel_node"
      ],
      "description": "What sort of place it is. Drives how the diary files what is found here, and which discipline gains from documenting it."
    },
    "stands": {
      "type": "string",
      "enum": [
        "high",
        "low",
        "either"
      ],
      "default": "either",
      "description": "Whether this place wants height, as distinct from a biome. `terrain` says what the ground is made of; this says where it sits on the slope, which is a different question and was not askable before. A watch stair wants somewhere you can see from; a drowned dockyard is underwater by definition. `either` is the honest default and most places mean it -- a midden is wherever the city put it.\n\nRead against the generator's three elevation terraces, the same ones cliffs are drawn between: `high` prefers band 1 or 2, `low` prefers band 0. A preference rather than a rule -- a map with no high ground still has to put the place somewhere, and refusing would lose it entirely.",
      "$comment": "Added when every point of interest on Lothal and Dwarka was landing on band 0 while both maps carried over a hundred and twenty hill tiles. Nothing was choosing badly: no place on either map listed `hills` in its terrain, so high ground was never a candidate. Canon was right about the biomes -- a silted granary and a tide market are low by their own description -- so the fix was a word for the thing canon could not say."
    },
    "terrain": {
      "type": "array",
      "description": "Which of the field map's biomes this can be placed on. The adapter needs somewhere plausible to put it.",
      "items": {
        "type": "string",
        "enum": [
          "sea",
          "coast",
          "plains",
          "forest",
          "wetland",
          "hills",
          "mountains",
          "snow",
          "desert",
          "river",
          "settlement",
          "landmark",
          "sky_island",
          "sky_underside",
          "open_sky",
          "underworld",
          "lava_field"
        ]
      }
    },
    "sub_locations": {
      "type": "array",
      "description": "Named places within this one, for a point of interest deep enough to be entered rather than merely visited. An empty or absent list means it is explored where it stands.",
      "items": {
        "type": "object",
        "required": [
          "id",
          "name"
        ],
        "properties": {
          "id": {
            "type": "string",
            "pattern": "^[a-z0-9_]+$"
          },
          "name": {
            "type": "string"
          },
          "description": {
            "type": "string"
          },
          "requires": {
            "type": "array",
            "items": {
              "type": "string"
            },
            "description": "Discovery or vocabulary ids that must be held before this can be reached. This is how a cave that is 'too dark' opens later."
          }
        },
        "additionalProperties": true
      }
    },
    "discoveries": {
      "type": "array",
      "items": {
        "type": "string"
      },
      "description": "discovery ids findable here."
    },
    "npcs": {
      "type": "array",
      "items": {
        "type": "string"
      },
      "description": "npc ids who can be met here."
    },
    "related_entities": {
      "type": "array",
      "items": {
        "type": "string"
      },
      "description": "Any canon ids this place is about -- a settlement, an event, a character, a species. This is what makes a place mean something rather than merely exist."
    },
    "epochs": {
      "type": "array",
      "items": {
        "type": "string"
      }
    },
    "description": {
      "type": "string",
      "description": "What the player sees on approach."
    },
    "arrival": {
      "type": "string",
      "description": "Longer prose for stepping inside. Player-facing."
    },
    "notes": {
      "type": "string",
      "description": "Reference fact for the canon reader."
    },
    "canon": {
      "type": "string",
      "enum": [
        "primary",
        "secondary",
        "draft"
      ],
      "default": "primary"
    },
    "sources": {
      "type": "array",
      "items": {
        "type": "string"
      }
    },
    "ruin_of": {
      "type": "string",
      "description": "The entity this place used to be, when it is now a wreck of it. Lothal in Epoch 5 is `kind: settlement` with `ruin_of: settlement_lothal` -- survivors camped inside the half-buried relic, so it is a living place and a ruin at once rather than either. Lets the diary say what stood here without duplicating the entity."
    },
    "shore": {
      "type": "string",
      "enum": [
        "near",
        "far",
        "either"
      ],
      "description": "Which side of a crossing this place is on, for maps that have two shores. `near` is the side the traveller arrives from -- Jambhudweepa, on the Aravali -- and `far` is the other. Absent means `either`, which is correct for every map that is one country rather than a crossing.\n\nThis is a fact about the place, not about play: a rail-head where people wait for the carriage is on the shore they wait on, and a map generator with no opinion put it on the wrong side of the water."
    }
  },
  "additionalProperties": false
}
